{
  "api_version": "v1",
  "profile_version": "v1",
  "entry_id": "dm80-image-64",
  "name": "Херъ",
  "data_status": {
    "catalog": "canonical-entry",
    "practice": "no-linked-practice-record",
    "stories": "no-linked-story-record"
  },
  "blocks": {
    "identity": {
      "name": "Херъ",
      "entry_id": "dm80-image-64",
      "source_image_number": 64
    },
    "glyph": {
      "image": "images/source-sheets/dm80/Image64.gif",
      "image_status": "local-copy",
      "source_image_url": "https://gramota.dm80.ru/prayazik/Image64.gif"
    },
    "source": {
      "source_url": "https://gramota.dm80.ru/prayazik/",
      "source_id": 58,
      "claim_status": "source-published-claim"
    },
    "claimed_description": {
      "text": "\"Херъ\" - Знак Женского ЖизнеНачала, \"Икс-Хромосома\". Букова, рекущая чрез ОДухоТворение Прошлого для Образумливания Будущего.",
      "status": "source-published-claim"
    },
    "practical_applications": [],
    "practitioner_stories": [],
    "evidence_and_limits": {
      "catalog_note": "The description is preserved as a source-attributed claim.",
      "practice_note": "Practical applications are secondary-source claims unless the linked record says otherwise.",
      "story_note": "Practitioner stories are testimony and are not independent validation."
    },
    "recovery": {
      "claimed_total": 147,
      "described_in_canonical_catalog": 68,
      "unfilled_claimed_slots": 79
    }
  }
}
