{
  "api_version": "v1",
  "profile_version": "v1",
  "entry_id": "dm80-image-58",
  "name": "Тау",
  "data_status": {
    "catalog": "canonical-entry",
    "practice": "no-linked-practice-record",
    "stories": "no-linked-story-record"
  },
  "blocks": {
    "identity": {
      "name": "Тау",
      "entry_id": "dm80-image-58",
      "source_image_number": 58
    },
    "glyph": {
      "image": "images/source-sheets/dm80/Image58.gif",
      "image_status": "local-copy",
      "source_image_url": "https://gramota.dm80.ru/prayazik/Image58.gif"
    },
    "source": {
      "source_url": "https://gramota.dm80.ru/prayazik/",
      "source_id": 52,
      "claim_status": "source-published-claim"
    },
    "claimed_description": {
      "text": "\"Тау\" - осваивающей НовоГлубостные биоэнергии НовоНебесной Человечностью действующая. Грамотное Восхождение Мужествами-Знаниями, которые являют Человечность в НовоСоТворяемые Космосы. С ПоМощью этой Буковы совершается выход более грубой Материи к Светоносности.",
      "status": "source-published-claim",
      "display_text": "Связывается с освоением новых биоэнергий, восхождением и переходом от более грубой материи к световой."
    },
    "practical_applications": [],
    "practitioner_stories": [],
    "evidence_and_limits": {
      "catalog_note": "The description is preserved as a source-attributed claim.",
      "practice_note": "Practical applications are secondary-source claims unless the linked record says otherwise.",
      "story_note": "Practitioner stories are testimony and are not independent validation."
    },
    "recovery": {
      "claimed_total": 147,
      "described_in_canonical_catalog": 68,
      "unfilled_claimed_slots": 79
    }
  }
}
